{
  "id": "2b_animals",
  "displayName": "Tierzucht",
  "description": "Suche in der Farmwelt nach Tieren und beginne mit einer Hühnerzucht.",
  "options": {
    "display": "egg"
  },
  "stages": [
    {
      "objectives": [
        {
          "id": "kill_pigs",
          "displayName": "Töte 5 Schweine!",
          "goal": 5,
          "type": "KillEntityObjective",
          "options": {
            "display": "{DataVersion:2586,id:\"minecraft:player_head\",tag:{Damage:3,display:{Name:'{\"extra\":[{\"bold\":false,\"italic\":false,\"underlined\":false,\"strikethrough\":false,\"obfuscated\":false,\"color\":\"blue\",\"text\":\"Pig\"}],\"text\":\"\"}'},SkullOwner:{Properties:{textures:[{Value:\"eyJ0ZXh0dXJlcyI6eyJTS0lOIjp7InVybCI6Imh0dHA6Ly90ZXh0dXJlcy5taW5lY3JhZnQubmV0L3RleHR1cmUvNjIxNjY4ZWY3Y2I3OWRkOWMyMmNlM2QxZjNmNGNiNmUyNTU5ODkzYjZkZjRhNDY5NTE0ZTY2N2MxNmFhNCJ9fX0=\"}]},Id:[I;67411088,-739686879,-1666252800,11182903]}},Count:1b}",
            "entities": [
              "minecraft:pig"
            ]
          }
        },
        {
          "id": "kill_cows",
          "displayName": "Töte 5 Kühe!",
          "goal": 5,
          "type": "KillEntityObjective",
          "options": {
            "display": "{DataVersion:2586,id:\"minecraft:player_head\",tag:{Damage:3,display:{Name:'{\"extra\":[{\"bold\":false,\"italic\":false,\"underlined\":false,\"strikethrough\":false,\"obfuscated\":false,\"color\":\"blue\",\"text\":\"Cow\"}],\"text\":\"\"}'},SkullOwner:{Properties:{textures:[{Value:\"eyJ0ZXh0dXJlcyI6eyJTS0lOIjp7InVybCI6Imh0dHA6Ly90ZXh0dXJlcy5taW5lY3JhZnQubmV0L3RleHR1cmUvNWQ2YzZlZGE5NDJmN2Y1ZjcxYzMxNjFjNzMwNmY0YWVkMzA3ZDgyODk1ZjlkMmIwN2FiNDUyNTcxOGVkYzUifX19\"}]},Id:[I;67411088,-739686879,-1666252800,11182901]}},Count:1b}",
            "entities": [
              "minecraft:cow"
            ]
          }
        },
        {
          "id": "kill_sheeps",
          "displayName": "Töte 5 Schafe!",
          "goal": 5,
          "type": "KillEntityObjective",
          "options": {
            "display": "{DataVersion:2586,id:\"minecraft:player_head\",tag:{Damage:3,display:{Name:'{\"extra\":[{\"bold\":false,\"italic\":false,\"underlined\":false,\"strikethrough\":false,\"obfuscated\":false,\"color\":\"blue\",\"text\":\"Sheep (white)\"}],\"text\":\"\"}'},SkullOwner:{Properties:{textures:[{Value:\"eyJ0ZXh0dXJlcyI6eyJTS0lOIjp7InVybCI6Imh0dHA6Ly90ZXh0dXJlcy5taW5lY3JhZnQubmV0L3RleHR1cmUvZjMxZjljY2M2YjNlMzJlY2YxM2I4YTExYWMyOWNkMzNkMThjOTVmYzczZGI4YTY2YzVkNjU3Y2NiOGJlNzAifX19\"}]},Id:[I;67411088,-739686879,-1666252800,11182900]}},Count:1b}",
            "entities": [
              "minecraft:sheep"
            ]
          }
        },
        {
          "id": "pet_chicken",
          "displayName": "Starte eine Hühnerzucht!",
          "goal": 5,
          "type": "BreedEntityObjective",
          "options": {
            "display": "{DataVersion:2586,id:\"minecraft:player_head\",tag:{Damage:3,display:{Name:'{\"extra\":[{\"bold\":false,\"italic\":false,\"underlined\":false,\"strikethrough\":false,\"obfuscated\":false,\"color\":\"blue\",\"text\":\"Chick\"}],\"text\":\"\"}'},SkullOwner:{Properties:{textures:[{Value:\"eyJ0ZXh0dXJlcyI6eyJTS0lOIjp7InVybCI6Imh0dHA6Ly90ZXh0dXJlcy5taW5lY3JhZnQubmV0L3RleHR1cmUvYTRkODE2YTQ3NWIzZjMxM2I2MjBkNjViZjkzNTg5MzFiNDZhZjljOGY0ZTdjOWFlNjQ3MDg4ODBiZWE2YmUifX19\"}]},Id:[I;67411088,-739686879,-1666252800,178930279]}},Count:1b}",
            "entities": [
              "minecraft:chicken"
            ]
          }
        }
      ]
    }
  ],
  "requirements": [
    {
      "id": "req_1",
      "type": "QuestCompletedRequirement",
      "options": {
        "quests": [
          "1a_ressources",
          "1b_iron"
        ]
      }
    }
  ],
  "rewards": [
    {
      "id": "moneyreward",
      "displayName": "40 Münzen",
      "type": "TransactionReward",
      "options": {
        "amount": 40.0
      }
    }
  ]
}
